{
  "schema_version": 1,
  "home": {"id": "default", "created_at": "2026-08-27T08:00:00Z"},
  "layout": {
    "personal": "personal",
    "workspaces": "workspaces",
    "system": "system"
  },
  "defaults": {
    "language": "zh-CN",
    "timezone": "Asia/Shanghai",
    "review_mode": "proposed_changes"
  }
}
